{
  "$schema": "http://json-schema.org/draft-07/schema#",
  "title": "Mutation",
  "description": "One client write. Atomic per entity: if any field conflicts, nothing in this mutation applies (other mutations in the same push still can).",
  "type": "object",
  "required": [
    "base_seq",
    "entity",
    "entity_id",
    "mutation_id",
    "op"
  ],
  "properties": {
    "base_seq": {
      "description": "The seq the client last saw for this entity. Conflict = a field the server changed since then.",
      "type": "integer",
      "format": "uint64",
      "minimum": 0.0
    },
    "entity": {
      "$ref": "#/definitions/EntityKind"
    },
    "entity_id": {
      "description": "Entity ULID. For `create`, the client generates it.",
      "type": "string"
    },
    "labels_add": {
      "description": "List fields (labels) travel as add/remove deltas so concurrent taggers don't clobber each other.",
      "default": [],
      "type": "array",
      "items": {
        "type": "string"
      }
    },
    "labels_remove": {
      "default": [],
      "type": "array",
      "items": {
        "type": "string"
      }
    },
    "mutation_id": {
      "description": "Client-generated ULID; the server's idempotency key. Replaying a mutation_id returns the original result instead of double-applying.",
      "type": "string"
    },
    "op": {
      "$ref": "#/definitions/Op"
    },
    "set": {
      "description": "Scalar fields: last-value set.",
      "default": {},
      "type": "object",
      "additionalProperties": true
    }
  },
  "definitions": {
    "EntityKind": {
      "type": "string",
      "enum": [
        "ticket",
        "comment",
        "project",
        "member",
        "label"
      ]
    },
    "Op": {
      "type": "string",
      "enum": [
        "create",
        "update",
        "delete"
      ]
    }
  }
}
